{
  "schema_version": 1,
  "project": "vllm-project/vllm",
  "cutoff": "2026-10-19",
  "source_mode": "live",
  "latest_stable": "v0.32.0",
  "artifacts": [
    {
      "path": "json/vllm_releases_normalized.json",
      "bytes": 5032804,
      "sha256": "10510be0e7b8b04bb11e271e772cf5631bbf59b6b15e31eeb6450164ab10ca7e"
    },
    {
      "path": "json/vllm_milestones.json",
      "bytes": 4194299,
      "sha256": "c074f1deca648f6e6eafc568c5939cf0ea5defcc2b2ca580f663c002b999214f"
    },
    {
      "path": "pdf/vLLM_Project_Analysis_Version_Feature_Timeline.pdf",
      "bytes": 60647,
      "sha256": "3504639e1474f9995a20666ddb3054bcc8e62ca20edd2fd2c3834c922e8308c0"
    },
    {
      "path": "pdf/vLLM_Evolution_Brief.pdf",
      "bytes": 5096,
      "sha256": "6a1b36c646a911df442ea0d53daece2176873dab31898e2908b6a35e3687c206"
    }
  ]
}
