{
  "schema_version": 1,
  "project": "sgl-project/sglang",
  "cutoff": "2026-07-18",
  "source_mode": "cache",
  "latest_stable": "v0.5.15",
  "artifacts": [
    {
      "path": "json/sglang_releases_normalized.json",
      "bytes": 2870845,
      "sha256": "1dca5a3bf25769f95ee7afdf34bc51a7a71eb69d12300e1b6302820a52d7397a"
    },
    {
      "path": "json/sglang_milestones.json",
      "bytes": 2765177,
      "sha256": "29bd422fd6286b836cdace84b833504296553d859b99e84e42b2d53a02cc59bf"
    },
    {
      "path": "pdf/SGLang_Project_Analysis_Version_Feature_Timeline.pdf",
      "bytes": 26914,
      "sha256": "2b3323d07f586b9e2c368514ce6ebca85d3a62abcc6704ac9a1a0f83e90c9e81"
    },
    {
      "path": "pdf/SGLang_Evolution_Brief.pdf",
      "bytes": 4709,
      "sha256": "3c2de46641e61545704bae0791e1e3a071a922149a0df49a3bd296a159610dcf"
    }
  ]
}
